topic_id,topic_name,subfield_id,subfield_name,field_id,field_name,domain_id,domain_name,keywords,summary,wikipedia_url
10766,Urban Heat Island Mitigation,2305,Environmental Engineering,23,Environmental Science,3,Physical Sciences,Urban Heat Island; Green Roofs; Land Surface Temperature; Remote Sensing; Urban Climate; Thermal Comfort; Energy Consumption; Vegetation; Cooling Strategies; Climate Change,"This cluster of papers focuses on the phenomenon of urban heat islands, the impact of urbanization and land-use change on climate, and various strategies to mitigate the heat island effect in urban environments. It covers topics such as green roofs, remote sensing of land surface temperature, urban climate modeling, and the role of vegetation in reducing urban heat. The papers also discuss the implications of urban heat islands on energy consumption, thermal comfort, and climate change.",https://en.wikipedia.org/wiki/Urban_heat_island
10779,Coastal wetland ecosystem dynamics,2303,Ecology,23,Environmental Science,3,Physical Sciences,Mangrove Forests; Coastal Protection; Carbon Sequestration; Sea-Level Rise; Ecosystem Services; Wetland Restoration; Climate Change; Tidal Wetlands; Salt Marshes; Global Carbon Budget,"This cluster of papers explores the importance of mangrove ecosystems in providing coastal protection, carbon sequestration, and various ecosystem services. It discusses the impact of sea-level rise, climate change, and human activities on mangrove forests, as well as the potential for wetland restoration. The research emphasizes the role of mangroves, tidal wetlands, and salt marshes in mitigating global carbon emissions and enhancing resilience to environmental changes.",https://en.wikipedia.org/wiki/Mangrove_ecosystem
10787,Lightning and Electromagnetic Phenomena,3103,Astronomy and Astrophysics,31,Physics and Astronomy,3,Physical Sciences,Lightning; Distribution; Physics; Terrestrial Gamma-Ray Flashes; Atmospheric Electric Circuit; Climate Change; Thunderstorms; Detection Systems; Electromagnetic Fields; Simulation,"This cluster of papers focuses on the global distribution, physics, and effects of lightning, including topics such as terrestrial gamma-ray flashes, the atmospheric electric circuit, climate change, thunderstorm dynamics, lightning detection systems, electromagnetic fields associated with lightning, and simulation of lightning-related phenomena.",https://en.wikipedia.org/wiki/Lightning
10809,Occupational Health and Safety Research,3614,Radiological and Ultrasound Technology,36,Health Professions,4,Health Sciences,Safety Culture; Occupational Safety; Safety Climate; Accident Prevention; Workplace Safety; Construction Safety; Safety Management; Organizational Culture; Employee Behavior; Risk Perception,"This cluster of papers focuses on enhancing workplace safety culture and practices, with a particular emphasis on occupational safety, accident prevention, and risk perception. The research covers various aspects of safety culture, safety climate, and organizational factors influencing employee behavior and safety management in industries such as construction.",https://en.wikipedia.org/wiki/Occupational_safety_and_health
10877,Allergic Rhinitis and Sensitization,2723,Immunology and Allergy,27,Medicine,4,Health Sciences,Allergen-specific Immunotherapy; Asthma; Pollen Allergy; T Regulatory Cells; Immunological Mechanisms; Sublingual Immunotherapy; House Dust Mite Allergens; Climate Change; Epidemiology; Quality of Life,"This cluster of papers focuses on the impact of allergic rhinitis on asthma, including allergen-specific immunotherapy, immunological mechanisms, and the influence of environmental factors such as pollen allergy and climate change. It also addresses the epidemiology, quality of life, and management strategies for allergic rhinitis and its comorbidity with asthma.",https://en.wikipedia.org/wiki/Allergic_rhinitis
10895,Species Distribution and Climate Change,2302,Ecological Modeling,23,Environmental Science,3,Physical Sciences,Species Distribution Modeling; Climate Change; Ecological Niche; MaxEnt; Biodiversity; Citizen Science; Habitat Suitability; Model Evaluation; Range Shifts; Conservation Biology,"This cluster of papers focuses on species distribution modeling in the context of climate change impacts, utilizing methods such as MaxEnt and ecological niche modeling. It explores the effects of climate change on biodiversity, habitat suitability, range shifts, and conservation efforts. Additionally, it highlights the role of citizen science in ecological research.",https://en.wikipedia.org/wiki/Species_distribution_modelling
10930,Flood Risk Assessment and Management,2306,Global and Planetary Change,23,Environmental Science,3,Physical Sciences,Flood Risk; Remote Sensing; Climate Change; Surface Water Mapping; Flood Inundation Modeling; Urban Flooding; Risk Perception; Hydrological Modeling; Satellite Imagery; Disaster Management,"This cluster of papers focuses on the assessment, mapping, and management of global flood risk, incorporating aspects such as remote sensing, climate change impacts, surface water mapping, flood inundation modeling, urban flooding, risk perception, hydrological modeling, satellite imagery, and disaster management.",https://en.wikipedia.org/wiki/Flood_risk_assessment
10969,Water resources management and optimization,2212,Ocean Engineering,22,Engineering,3,Physical Sciences,Water Resources; Reservoir Operation; Water Demand; Climate Change; Sustainability; Hydro-Economic Models; Urbanization; System Dynamics; Robust Decision Making; Groundwater Management,"This cluster of papers focuses on the optimal operation and management of water resources systems, addressing challenges such as reservoir operation, water demand forecasting, climate change impacts, sustainability, hydro-economic modeling, urbanization effects, system dynamics applications, robust decision making, and groundwater management.",https://en.wikipedia.org/wiki/Water_resources
11056,Physiological and biochemical adaptations,2303,Ecology,23,Environmental Science,3,Physical Sciences,Metabolic Rate; Climate Change; Temperature; Physiological Adaptation; Thermal Tolerance; Ectotherms; Oxygen Limitation; Body Size; Diapause; Evolutionary Response,"This cluster of papers explores the metabolic theory of ecology and the impacts of climate change on organisms, focusing on topics such as metabolic rate, temperature effects, physiological adaptation, thermal tolerance, and evolutionary responses to environmental stressors.",https://en.wikipedia.org/wiki/Metabolic_ecology
11061,Ocean Waves and Remote Sensing,1910,Oceanography,19,Earth and Planetary Sciences,3,Physical Sciences,Ocean Waves; Wind Stress; Wave Climate; Rogue Waves; Tropical Cyclones; Wave Modeling; Surface Turbulence; Satellite Altimetry; Langmuir Turbulence; Air-Sea Interaction,"This cluster of papers explores the dynamics of ocean surface waves, their interaction with wind, and the associated phenomena such as rogue waves, tropical cyclones, and Langmuir turbulence. It covers topics such as wave modeling, wind stress, satellite altimetry, and the impact of surface waves on air-sea interaction.",https://en.wikipedia.org/wiki/Wind_wave
11119,Urban Stormwater Management Solutions,2305,Environmental Engineering,23,Environmental Science,3,Physical Sciences,Urban Stormwater Management; Sustainable Drainage Systems; Low Impact Development Practices; Bioretention Technology; Urban Hydrology; Water Quality; Impervious Surfaces; Rainwater Harvesting; Pollutant Removal; Climate Change Impact,"This cluster of papers focuses on urban stormwater management, sustainable drainage systems, and the impact of urbanization on hydrology and water quality. It covers topics such as low impact development practices, bioretention technology, the effects of impervious surfaces, rainwater harvesting, pollutant removal, and the influence of climate change on urban drainage systems.",https://en.wikipedia.org/wiki/Sustainable_drainage_system
11186,Hydrology and Drought Analysis,2306,Global and Planetary Change,23,Environmental Science,3,Physical Sciences,Drought; Monitoring; Global Warming; Hydrological; Indices; Remote Sensing; Climate Change; Evapotranspiration; Severity; Frequency,"This cluster of papers focuses on the monitoring, assessment, and impacts of drought at a global scale. It covers various aspects such as the development of drought indices, the influence of global warming and climate change on drought severity and frequency, hydrological implications, remote sensing techniques for drought monitoring, and the use of evapotranspiration data. The research also delves into the challenges and future directions in drought assessment.",https://en.wikipedia.org/wiki/Drought_monitoring
11228,Bat Biology and Ecology Studies,1105,"Ecology, Evolution, Behavior and Systematics",11,Agricultural and Biological Sciences,1,Life Sciences,Bats; Hibernation; Echolocation; White-Nose Syndrome; Metabolic Rate; Molecular Phylogeny; Conservation; Foraging Behavior; Climate Change; Disease Ecology,"This cluster of papers explores the ecology, behavior, physiology, and conservation of bats, with a focus on topics such as hibernation, echolocation, white-nose syndrome, metabolic rate, molecular phylogeny, and the impact of climate change. The papers also discuss the role of bats in ecosystems, their importance as bioindicators, and their potential as reservoirs for zoonotic pathogens.",https://en.wikipedia.org/wiki/Bat_ecology
11244,Climate Change and Health Impacts,2307,"Health, Toxicology and Mutagenesis",23,Environmental Science,3,Physical Sciences,Climate Change; Human Health; Mortality; Heat Waves; Public Health; Temperature; Epidemiological Evidence; Global Warming; Infectious Diseases; Vulnerability,"This cluster of papers explores the impact of climate change on human health, focusing on mortality, heat waves, and infectious diseases. It discusses epidemiological evidence, public health implications, and the vulnerability of populations to extreme temperatures and environmental changes.",https://en.wikipedia.org/wiki/Climate_change_and_health
11259,Agriculture Sustainability and Environmental Impact,2303,Ecology,23,Environmental Science,3,Physical Sciences,Sustainable Diets; Environmental Impact; Food Systems; Climate Change; Livestock Production; Health Effects; Plant-Based Diets; Greenhouse Gas Emissions; Dietary Choices; Global Food System,"This cluster of papers explores the intersection of sustainable diets, environmental impact, and global food systems. It delves into the effects of food choices on climate change, livestock production, and health, emphasizing the potential of plant-based diets to mitigate greenhouse gas emissions and reduce environmental footprint. The research also addresses the challenges and opportunities in transitioning towards more sustainable dietary patterns within the context of a rapidly changing global food system.",https://en.wikipedia.org/wiki/Sustainable_diet
11320,Atmospheric Ozone and Climate,1902,Atmospheric Science,19,Earth and Planetary Sciences,3,Physical Sciences,Stratospheric Water Vapor; Ozone Depletion; Tropopause Layer; Climate Impact; Brewer-Dobson Circulation; Atmospheric Composition; Remote Sensing Instruments; Chemical Transport Model; Solar Cycle Influence; Montreal Protocol,"This cluster of papers focuses on the study of stratospheric chemistry, with a particular emphasis on the impacts of ozone depletion, changes in stratospheric water vapor, and the influence of the Brewer-Dobson circulation on climate. It also covers the role of remote sensing instruments and chemical transport models in understanding atmospheric composition and climate impact. The cluster highlights the significance of the Montreal Protocol in protecting the ozone layer and addresses the influence of solar cycle variations on stratospheric chemistry.",https://en.wikipedia.org/wiki/Stratospheric_chemistry
11333,Climate change and permafrost,1902,Atmospheric Science,19,Earth and Planetary Sciences,3,Physical Sciences,Permafrost; Arctic; Climate Change; Carbon Feedback; Thawing; Methane Emissions; Tundra; Vegetation Change; Hydrology; Ecosystem Response,"This cluster of papers focuses on the dynamics of Arctic permafrost in the context of climate change, including its impact on carbon feedback, methane emissions, vegetation change, and hydrology. The research covers a wide range of topics such as soil organic carbon pools, shrub expansion, tundra biome responses, and the vulnerability of high-latitude soil organic carbon.",https://en.wikipedia.org/wiki/Permafrost#Arctic_permafrost
11371,Wind and Air Flow Studies,2305,Environmental Engineering,23,Environmental Science,3,Physical Sciences,CFD Simulation; Urban Microclimate; Air Quality; Pedestrian Wind Comfort; Turbulent Flow; Building Ventilation; Atmospheric Dispersion; Large-Eddy Simulation; Street Canyon; Boundary Layer,"This cluster of papers focuses on the modeling and simulation of urban wind environments, air quality, and atmospheric dispersion. It covers topics such as CFD simulation, urban microclimate, pedestrian wind comfort, turbulent flow, building ventilation, and boundary layer dynamics.",https://en.wikipedia.org/wiki/Urban_microclimate
11400,Motivation and Self-Concept in Sports,3207,Social Psychology,32,Psychology,2,Social Sciences,Self-Determination Theory; Intrinsic Motivation; Autonomy Support; Psychological Needs; Motivational Climate; Well-Being; Exercise Motivation; Goal Pursuits; Social Development; Teacher Strategies,"This cluster of papers explores the application and implications of Self-Determination Theory in understanding human motivation, well-being, and behavior across various domains such as education, sports, and health. It delves into topics such as intrinsic motivation, autonomy support, psychological needs satisfaction, motivational climate, and the impact on individual and social development.",https://en.wikipedia.org/wiki/Self-determination_theory
11405,Geophysics and Gravity Measurements,1910,Oceanography,19,Earth and Planetary Sciences,3,Physical Sciences,GRACE; sea level rise; groundwater depletion; climate change; satellite measurements; polar ice sheets; hydrological modeling; geodetic measurements; mass variability; land water storage,"This cluster of papers focuses on the global variability and change in sea level, with an emphasis on utilizing GRACE and other satellite measurements to understand factors such as groundwater depletion, polar ice sheet mass loss, and the impact of climate change. The papers also explore the use of hydrological and geodetic modeling to assess land water storage and its contribution to sea level rise.",https://en.wikipedia.org/wiki/Sea_level_rise
11459,Arctic and Antarctic ice dynamics,1902,Atmospheric Science,19,Earth and Planetary Sciences,3,Physical Sciences,Arctic; Sea Ice; Decline; Variability; Climate Change; Remote Sensing; Ocean Circulation; Freshwater Cycle; Antarctic Comparison; Atmospheric Circulation,"This cluster of papers focuses on the variability and decline of Arctic sea ice, including topics such as climate change impacts, remote sensing techniques, ocean circulation, freshwater cycle, and comparisons with Antarctic sea ice. The research synthesizes historical trends, observational data, and modeling to understand the rapid changes in the Arctic sea ice cover.",https://en.wikipedia.org/wiki/Arctic_sea_ice_decline
11483,Tropical and Extratropical Cyclones Research,1902,Atmospheric Science,19,Earth and Planetary Sciences,3,Physical Sciences,Tropical Cyclones; Climate Change; Hurricanes; Storm Surge; Global Warming; Intensity; Trends; Sea Level Rise; ENSO; Wind Shear,"This cluster of papers focuses on the relationship between tropical cyclone intensity and climate change, including the impact of global warming, sea level rise, and environmental factors such as ENSO and wind shear. It also examines trends in tropical cyclone activity and the associated storm surge risks.",https://en.wikipedia.org/wiki/Tropical_cyclone
11488,Climate Change Communication and Perception,3312,Sociology and Political Science,33,Social Sciences,2,Social Sciences,Climate Change; Public Perception; Science Communication; Risk Perception; Media Coverage; Policy Preferences; Global Warming; Psychological Responses; Cultural Cognition; Environmental Attitudes,"This cluster of papers explores the perceptions, communication, and societal responses to climate change, including public attitudes, risk perception, media coverage, policy preferences, psychological impacts, and cultural cognition. It delves into the role of affect, imagery, values, and science literacy in shaping public views on global warming and climate change. The cluster also addresses the politicization of climate change, barriers to engagement, and the impact of personal experience on risk perception.",https://en.wikipedia.org/wiki/Climate_change_communication
11524,Advanced Aircraft Design and Technologies,2306,Global and Planetary Change,23,Environmental Science,3,Physical Sciences,Aviation; Climate Change; Alternative Fuels; Emissions; Aircraft Design; Renewable Jet Fuel; Contrails; Hydrogen Technology; Electric Propulsion; Air Quality,"This cluster of papers explores the intersection of aviation and global climate change, focusing on the impact of aviation emissions, alternative fuels, aircraft design for reduced environmental impact, and technologies such as hydrogen and electric propulsion. It also delves into the effects of contrails, renewable jet fuel production, and the implications for air quality.",https://en.wikipedia.org/wiki/Environmental_impact_of_aviation
11537,Ethics in medical practice,3600,General Health Professions,36,Health Professions,4,Health Sciences,Moral Distress; Ethical Climate; Nurse-Physician Collaboration; Intensive Care Units; Ethics Consultation; Burnout; Autonomy; Healthcare Ethics; Professionalism Dilemmas; Empirical Ethics,"This cluster of papers explores the concept of moral distress in healthcare professionals, particularly focusing on nurses and physicians in intensive care units. It delves into the ethical climate, nurse-physician collaboration, burnout, autonomy, and the role of ethics consultation in addressing moral distress. The papers also discuss the impact of moral distress on job satisfaction, turnover intentions, and professional quality of life.",https://en.wikipedia.org/wiki/Moral_distress
11546,Plant Physiology and Cultivation Studies,1110,Plant Science,11,Agricultural and Biological Sciences,1,Life Sciences,Fruit Trees; Dormancy; Chilling Requirement; Rootstock; Carbohydrate Metabolism; Climate Change; Growth Regulation; Flowering; Orchard Management; Nutrient Uptake,"This cluster of papers explores the physiology, dormancy, chilling requirements, rootstock effects, carbohydrate metabolism, and management practices related to fruit trees. It also discusses the impact of climate change on fruit tree growth and development.",https://en.wikipedia.org/wiki/Fruit_tree_physiology
11594,Tree-ring climate responses,1902,Atmospheric Science,19,Earth and Planetary Sciences,3,Physical Sciences,Climate Change; Tree Rings; Temperature Variability; Dendrochronology; Global Warming; Historical Climate; Extreme Events; Paleoclimatology; Precipitation Variability; Tree Line Shifts,"This cluster of papers explores the causes and impacts of climate change over the past millennia, focusing on temperature variability, tree ring analysis, historical climate reconstructions, extreme events, and precipitation variability. It encompasses studies on dendrochronology, global warming, and the shifting of tree lines in response to environmental changes.",https://en.wikipedia.org/wiki/Paleoclimatology
11656,Turtle Biology and Conservation,2309,Nature and Landscape Conservation,23,Environmental Science,3,Physical Sciences,Marine Turtles; Conservation; Bycatch; Satellite Tracking; Climate Change; Nesting Habitat; Population Dynamics; Sea-Level Rise; Thermal Conditions; Genetic Structure,"This cluster of papers focuses on the conservation and management of marine turtles worldwide, with an emphasis on understanding the impacts of fisheries bycatch, satellite tracking, climate change, nesting habitat, population dynamics, sea-level rise, thermal conditions, and genetic structure. The research priorities include informing global conservation efforts and addressing the threats faced by marine turtle populations.",https://en.wikipedia.org/wiki/Sea_turtle_conservation
11684,Vibrio bacteria research studies,1310,Endocrinology,13,"Biochemistry, Genetics and Molecular Biology",1,Life Sciences,Cholera; Vibrio cholerae; Type VI Secretion System; Bacterial Pathogenesis; Epidemiology; Viable but Non-culturable State; Climate Influence; Bacterial Transmission; Environmental Reservoirs; Global Impact,"This cluster of papers explores the dynamics, pathogenesis, and epidemiology of cholera bacteria, primarily focusing on Vibrio cholerae. It covers topics such as the Type VI Secretion System, viable but non-culturable state, climate influence on disease spread, bacterial transmission, environmental reservoirs, and the global impact of cholera.",https://en.wikipedia.org/wiki/Cholera
11691,Forest Insect Ecology and Management,2303,Ecology,23,Environmental Science,3,Physical Sciences,Forest Pests; Bark Beetles; Invasive Species; Climate Change; Ecosystem Disturbances; Tree Defense Mechanisms; Global Warming; Pathogen Invasions; Economic Impacts; Biological Invasions,"This cluster of papers explores the complex interactions and impacts of forest pest dynamics, focusing on bark beetles, invasive species, climate change, ecosystem disturbances, tree defense mechanisms, and the economic implications of biological invasions. The research delves into the drivers, consequences, and management strategies related to forest pest outbreaks and their effects on forest ecosystems.",https://en.wikipedia.org/wiki/Forest_health
11753,Forest Management and Policy,2306,Global and Planetary Change,23,Environmental Science,3,Physical Sciences,Forest Carbon Sequestration; Climate Change Impacts; Sustainable Forest Management; Economic Value; Adaptive Management; Biodiversity Conservation; Private Forest Ownership; Carbon Sinks; Timber Production; European Forestry,"This cluster of papers focuses on the impacts of climate change on forest carbon sequestration, sustainable forest management, and the economic value of European forests. It covers topics such as adaptive forest management, biodiversity conservation, private forest ownership, and the role of forests in mitigating climate change through carbon sinks.",https://en.wikipedia.org/wiki/Forest_carbon_sequestration
11755,Transboundary Water Resource Management,3312,Sociology and Political Science,33,Social Sciences,2,Social Sciences,Climate Change; Conflict; Water Resources; Transboundary Water; Security; Drought; Arid Regions; International Cooperation; Environmental Impact; Resource Scarcity,"This cluster of papers explores the complex relationship between climate change, water resources, and conflict, particularly in arid regions. It delves into the impact of environmental degradation, drought, and transboundary water issues on human security and violent conflict. The papers also discuss international cooperation, resource scarcity, and the potential for climate-informed conflicts in the future.",https://en.wikipedia.org/wiki/Climate_change_and_conflict
11760,Plant responses to elevated CO2,1110,Plant Science,11,Agricultural and Biological Sciences,1,Life Sciences,CO2 Enrichment; Ozone Effects; Plant Growth; Photosynthesis; Stomatal Conductance; Crop Yield; Climate Change; Nitrogen Assimilation; Particulate Pollution; Food Security,"This cluster of papers explores the impacts of elevated carbon dioxide (CO2) and ozone on plant physiology, including effects on photosynthesis, stomatal conductance, crop yield, nitrogen assimilation, and responses to particulate pollution. The research also addresses the implications for food security and the broader effects of climate change on plant responses.",https://en.wikipedia.org/wiki/Effects_of_global_warming_on_plants
11796,Horticultural and Viticultural Research,1110,Plant Science,11,Agricultural and Biological Sciences,1,Life Sciences,Grapevine; Genetics; Climate Change; Wine Quality; Anthocyanins; Water Deficit; Transcriptome Analysis; Viticulture; Terroir; Grape Berry Ripening,"This cluster of papers explores the genetic and environmental factors influencing grapevine cultivation, including the impact of climate change on wine quality, the role of anthocyanins and water deficit in grape development, transcriptome analysis of grape berries, and the concept of terroir in viticulture.",https://en.wikipedia.org/wiki/Vitis_vinifera
11836,Bryophyte Studies and Records,1105,"Ecology, Evolution, Behavior and Systematics",11,Agricultural and Biological Sciences,1,Life Sciences,Bryophyte; Phylogeny; Mosses; Liverworts; Hornworts; Cryptic Speciation; Biogeography; Chemical Diversity; Climate Change Indicators; Habitat Fragmentation,"This cluster of papers explores the diversity, evolution, and ecological significance of bryophytes, including mosses, liverworts, and hornworts. It delves into topics such as phylogeny, cryptic speciation, biogeography, chemical diversity, and the role of bryophytes as indicators of climate change and habitat fragmentation.",https://en.wikipedia.org/wiki/Bryophyte
