topic_id,topic_name,subfield_id,subfield_name,field_id,field_name,domain_id,domain_name,keywords,summary,wikipedia_url
10004,Soil Carbon and Nitrogen Dynamics,1111,Soil Science,11,Agricultural and Biological Sciences,1,Life Sciences,Soil Carbon Sequestration; Nitrogen Cycle; Microbial Communities; Climate Change; Biochar Application; Ecosystem Functioning; Soil Fertility; Organic Matter Dynamics; Nutrient Limitation; Global Biogeochemical Cycles,"This cluster of papers explores the dynamics of soil carbon, nitrogen cycling, and microbial communities in various ecosystems. It investigates topics such as soil carbon sequestration, biochar application, nutrient limitation, and the impact of climate change on soil fertility and ecosystem functioning. The research also delves into the interactions between soil microbial communities and plant diversity, with a focus on understanding global biogeochemical cycles.",https://en.wikipedia.org/wiki/Soil_carbon_dynamics
10017,Geology and Paleoclimatology Research,1902,Atmospheric Science,19,Earth and Planetary Sciences,3,Physical Sciences,Climate Change; Paleoclimatology; Glacial Cycles; Holocene; Sea Level; Monsoon Dynamics; Greenhouse Warming; Ice Core Records; Solar Influence; Atmospheric CO2,"This cluster of papers encompasses research on climate change and paleoclimatology, including topics such as glacial cycles, Holocene climate variability, sea level fluctuations, monsoon dynamics, greenhouse warming, ice core records, solar influence on climate, and atmospheric CO2 concentrations over various timescales.",https://en.wikipedia.org/wiki/Paleoclimatology
10029,Climate variability and models,2306,Global and Planetary Change,23,Environmental Science,3,Physical Sciences,Climate Change; Global Warming; Extreme Events; Climate Modeling; Precipitation Extremes; Ocean Circulation; ENSO Variability; Arctic Amplification; Hydrological Cycle; Greenhouse Gas Emissions,"This cluster of papers encompasses a wide range of research on climate change, global warming, and variability, including studies on extreme events, climate modeling, precipitation extremes, ocean circulation, ENSO variability, Arctic amplification, and the hydrological cycle. It also addresses the impact of greenhouse gas emissions and the challenge of keeping global warming below 2°C.",https://en.wikipedia.org/wiki/Climate_change
10032,Marine and coastal ecosystems,1910,Oceanography,19,Earth and Planetary Sciences,3,Physical Sciences,Dissolved Organic Matter; Eutrophication; Harmful Algal Blooms; Oceanic Carbon Cycle; Phytoplankton; Global Warming; Nutrient Limitation; Biological Productivity; Oceanic Oxygen Levels; Climate Change,"This cluster of papers focuses on the complex interactions between marine biogeochemistry, ecosystem dynamics, and environmental factors such as eutrophication, harmful algal blooms, and climate change. It explores the role of dissolved organic matter, nutrient limitation, and phytoplankton in the oceanic carbon cycle and highlights the impact of global warming on biological productivity and oxygen levels in the oceans.",https://en.wikipedia.org/wiki/Marine_biogeochemistry
10075,Atmospheric chemistry and aerosols,1902,Atmospheric Science,19,Earth and Planetary Sciences,3,Physical Sciences,Atmospheric Aerosols; Black Carbon; Organic Aerosol; Air Quality; Climate Forcing; Aerosol Formation; Emission Modeling; Chemical Composition; Haze Pollution; Tropospheric Chemistry,"This cluster of papers focuses on the characteristics, sources, impacts, and modeling of atmospheric aerosols, including black carbon and organic aerosols. It explores their role in air quality, climate forcing, haze pollution, and tropospheric chemistry.",https://en.wikipedia.org/wiki/Atmospheric_aerosol
10089,Avian ecology and behavior,2303,Ecology,23,Environmental Science,3,Physical Sciences,Avian Ecology; Climate Change; Migration Patterns; Population Declines; Phenological Changes; Habitat Selection; Model Selection; Multimodel Inference; Agricultural Intensification; Conservation Actions,"This cluster of papers focuses on the ecological impacts of climate change on avian populations, including migration patterns, population declines, phenological changes, and habitat selection. It also discusses model selection and multimodel inference in the context of avian ecology, as well as the effects of agricultural intensification and conservation actions on bird populations.",https://en.wikipedia.org/wiki/Effects_of_climate_change_on_birds
10109,Paleontology and Stratigraphy of Fossils,1911,Paleontology,19,Earth and Planetary Sciences,3,Physical Sciences,Paleoredox; Paleoproductivity; Trace Metals; Oceanic Anoxic Events; Atmospheric Oxygenation; Biogeochemical Cycling; Isotope Geochemistry; Marine Sediments; Phanerozoic Climate; Mass Extinctions,"This cluster of papers focuses on the use of trace metals, isotopes, and biogeochemical indicators to reconstruct paleoredox conditions and paleoproductivity in ancient oceans. It explores topics such as oceanic anoxic events, atmospheric oxygenation, biogeochemical cycling, and their implications for Phanerozoic climate and mass extinctions.",https://en.wikipedia.org/wiki/Paleoredox
10111,Remote Sensing in Agriculture,2303,Ecology,23,Environmental Science,3,Physical Sciences,Remote Sensing; Vegetation Monitoring; Phenology; MODIS; Landsat; NDVI; Global Change; Climate; Biomass Estimation; Machine Learning,"This cluster of papers focuses on the use of remote sensing technology, particularly MODIS and Landsat data, for monitoring vegetation dynamics, phenology, and biomass estimation in response to global change and climate variability. The papers also explore the application of machine learning techniques for land cover classification and the assessment of ecological responses to environmental change.",https://en.wikipedia.org/wiki/Remote_sensing
10119,Sustainability and Climate Change Governance,2306,Global and Planetary Change,23,Environmental Science,3,Physical Sciences,Sustainability Transitions; Resilience; Social-Ecological Systems; Adaptive Governance; Climate Change Adaptation; Renewable Energy; Policy Mixes; Scenario Planning; Transition Management; Socio-Technical Perspective,"This cluster of papers explores sustainability transitions and resilience in social-ecological systems, focusing on topics such as adaptive governance, climate change adaptation, renewable energy, policy mixes, scenario planning, and transition management. It emphasizes the socio-technical perspective and the need for transformative change to address global environmental challenges.",https://en.wikipedia.org/wiki/Sustainability_transitions
10121,Building Energy and Comfort Optimization,2215,Building and Construction,22,Engineering,3,Physical Sciences,Building Energy Consumption; Thermal Comfort; Energy Simulation; Model Predictive Control; Sustainable Buildings; Occupant Behavior; Climate Change Impact; Artificial Neural Networks; Energy Efficiency; Building Performance,"This cluster of papers focuses on building energy efficiency, thermal comfort optimization, and the impact of occupant behavior and climate change on energy consumption. It covers topics such as energy simulation, model predictive control, sustainable buildings, occupant behavior modeling, and the use of artificial neural networks for predicting building energy consumption.",https://en.wikipedia.org/wiki/Building_energy_efficiency
10230,Marine and fisheries research,2306,Global and Planetary Change,23,Environmental Science,3,Physical Sciences,Climate Change; Marine Fisheries; Ecosystem Management; Fish Population Dynamics; Oceanic Ecosystems; Fisheries Sustainability; Trophic Cascades; Global Fish Production; Estuarine Habitats; Otolith Chemistry,"This cluster of papers focuses on the impacts of climate change on marine fisheries, including topics such as fish population dynamics, trophic cascades, ecosystem management, and the sustainability of global fish production. It also explores the influence of climate change on estuarine habitats and the use of otolith chemistry in understanding fish life cycles.",https://en.wikipedia.org/wiki/Effects_of_climate_change_on_fisheries
10236,Aquatic Ecosystems and Phytoplankton Dynamics,2304,Environmental Chemistry,23,Environmental Science,3,Physical Sciences,Eutrophication; Harmful Algal Blooms; Cyanobacteria; Nutrient Control; Climate Change; Freshwater Ecosystems; Toxins; Phosphorus; Lake Management; Water Quality,"This cluster of papers focuses on the phenomenon of eutrophication in freshwater and coastal marine ecosystems, particularly its role in promoting harmful algal blooms dominated by cyanobacteria. The papers discuss the links between eutrophication, climate change, nutrient control, and the management of lakes and reservoirs to mitigate the impacts of harmful algal blooms. Additionally, they explore the ecological and health implications of toxins produced by cyanobacteria in the context of eutrophication.",https://en.wikipedia.org/wiki/Eutrophication
10255,Oceanographic and Atmospheric Processes,1910,Oceanography,19,Earth and Planetary Sciences,3,Physical Sciences,Oceanic Modeling; Ocean Circulation; Tidal Analysis; Mesoscale Eddies; Mixed Layer Depth; Global Heat Transport; Data Assimilation; Submesoscale Processes; Estuarine Circulation; Climate Change Impact,"This cluster of papers focuses on oceanic modeling, circulation dynamics, and the impact of various physical processes on the global ocean. It includes studies on tidal analysis, mesoscale eddies, mixed layer depth variations, global heat transport, data assimilation techniques, submesoscale processes, estuarine circulation, and the influence of climate change on ocean dynamics.",https://en.wikipedia.org/wiki/Ocean_model
10266,Plant Water Relations and Carbon Dynamics,2306,Global and Planetary Change,23,Environmental Science,3,Physical Sciences,Drought; Tree Mortality; Climate Change; Ecosystem Resilience; Evapotranspiration; Carbon Balance; Hydraulic Conductance; Stomatal Response; Global Vegetation Models; Eddy Covariance,"This cluster of papers explores the impact of drought and heat-induced tree mortality on global forests, highlighting emerging climate change risks. It delves into mechanisms of plant survival and mortality during drought, ecosystem dynamics, carbon cycling, and the role of stomata in driving environmental change. The research also evaluates the vulnerability of forests to drought, the global distribution of terrestrial carbon dioxide uptake, and the implications of widespread tree mortality triggered by climate stress.",https://en.wikipedia.org/wiki/Forest_ecology
10302,Fish Ecology and Management Studies,2309,Nature and Landscape Conservation,23,Environmental Science,3,Physical Sciences,Freshwater Biodiversity; Conservation Challenges; Flow Regulation; Hydropower Dam Construction; Environmental Flows; Invasive Species; Climate Change; Fisheries Sustainability; Habitat Fragmentation; River Ecosystems,"This cluster of papers focuses on the importance, threats, status, and conservation challenges related to freshwater biodiversity. It covers topics such as flow regulation, hydropower dam construction, environmental flows, invasive species, climate change impacts, fisheries sustainability, and habitat fragmentation in river ecosystems.",https://en.wikipedia.org/wiki/Freshwater_biodiversity
10319,"Conservation, Biodiversity, and Resource Management",2306,Global and Planetary Change,23,Environmental Science,3,Physical Sciences,Tropical Deforestation; Environmental Services; Protected Areas; Community-Based Conservation; Biodiversity Conservation; Payments for Ecosystem Services; Climate Change; Forest Governance; Land Use Change; Global Forest Transition,"This cluster of papers explores the drivers, impacts, and governance of tropical deforestation, including topics such as payments for ecosystem services, community-based conservation, protected areas, and the relationship between deforestation and climate change. It also delves into the challenges and potential solutions related to biodiversity conservation in the context of land use change and global forest transition.",https://en.wikipedia.org/wiki/Deforestation
10330,Hydrology and Watershed Management Studies,2312,Water Science and Technology,23,Environmental Science,3,Physical Sciences,Hydrological Modeling; Water Resources; Climate Change; Model Evaluation; Global Hydrology; Uncertainty Assessment; Watershed Simulation; Sediment Transport; Land Use Change; Streamflow Trends,"This cluster of papers focuses on hydrological modeling, water resource management, and the impact of climate change on global hydrology. It covers topics such as model evaluation guidelines, watershed simulations, sediment transport, land use change, and uncertainty assessment in hydrological modeling. The papers also discuss the effects of human interventions and climate change on water resources, as well as the evaluation of streamflow trends and the implications for water availability.",https://en.wikipedia.org/wiki/Hydrological_modeling
10332,Amphibian and Reptile Biology,2306,Global and Planetary Change,23,Environmental Science,3,Physical Sciences,Amphibian Declines; Chytridiomycosis; Climate Change; Biodiversity Loss; Pathogen Impact; Habitat Fragmentation; Species Extinction; Phylogenetic Analysis; Population Dynamics; Conservation Biology,"This cluster of papers focuses on the global declines and extinctions of amphibian species, with a particular emphasis on the impact of chytridiomycosis, climate change, habitat fragmentation, and biodiversity loss. The papers cover topics such as pathogen impact, phylogenetic analysis, population dynamics, and conservation biology in the context of amphibian declines.",https://en.wikipedia.org/wiki/Decline_in_amphibian_populations
10341,Coral and Marine Ecosystems Studies,2303,Ecology,23,Environmental Science,3,Physical Sciences,Coral Reefs; Climate Change; Marine Ecosystems; Ocean Acidification; Bleaching; Marine Reserves; Symbiotic Dinoflagellates; Coral Disease; Marine Population Connectivity; Coral Microbiome,"This cluster of papers focuses on the resilience of coral reef ecosystems to the impacts of climate change, including ocean acidification, bleaching, and disease. It explores the role of marine reserves, symbiotic dinoflagellates, and population connectivity in maintaining the health and biodiversity of coral reefs. The cluster also addresses the importance of the coral microbiome and the potential effects of nutrient pollution on coral reef ecosystems.",https://en.wikipedia.org/wiki/Coral_reef_conservation
10347,Atmospheric aerosols and clouds,2306,Global and Planetary Change,23,Environmental Science,3,Physical Sciences,Aerosols; Climate; Hydrological Cycle; Atmospheric Dust; Radiative Forcing; Clouds; Satellite Observations; Air Quality; Ice Nucleation; Remote Sensing,"This cluster of papers focuses on the impact of aerosols on climate and the hydrological cycle. It covers topics such as aerosol properties, radiative forcing, cloud interactions, ice nucleation, and air quality, using satellite observations and remote sensing techniques.",https://en.wikipedia.org/wiki/Aerosol%E2%80%93climate_interaction
10398,Groundwater and Isotope Geochemistry,1906,Geochemistry and Petrology,19,Earth and Planetary Sciences,3,Physical Sciences,Groundwater; Isotopes; Stable; Precipitation; Nitrate; Recharge; Climate Change; Water Quality; Hydrogeochemical Processes; Global Depletion,"This cluster of papers focuses on the stable isotopic analysis of groundwater and precipitation, including the use of isotopes to study nitrate contamination, groundwater recharge, climate change impacts, and water quality. It also addresses global depletion of groundwater resources and hydrogeochemical processes influencing groundwater composition.",https://en.wikipedia.org/wiki/Groundwater_isotope_hydrology
10406,Planetary Science and Exploration,3103,Astronomy and Astrophysics,31,Physics and Astronomy,3,Physical Sciences,Mars; Martian Surface; Planetary Exploration; Water on Mars; Martian Climate; Mars Orbiter Missions; Martian Minerals; Life in Extreme Environments; Surface Composition; Martian Atmosphere,"This cluster of papers focuses on the exploration and study of Mars, including the Martian surface, planetary exploration missions, the search for water and signs of life, the Martian climate, minerals found on Mars, and the composition of the Martian atmosphere.",https://en.wikipedia.org/wiki/Exploration_of_Mars
10439,Climate change impacts on agriculture,1105,"Ecology, Evolution, Behavior and Systematics",11,Agricultural and Biological Sciences,1,Life Sciences,Climate Change; Agriculture; Adaptation; Food Security; Vulnerability; Crop Production; Sustainability; Global Warming; Water Management; Extreme Weather,"This cluster of papers focuses on the challenges and strategies for adapting agriculture to climate change, with an emphasis on ensuring food security, managing vulnerability, and sustaining crop production. The research covers topics such as climate change impacts on global food security, adaptation methods for agricultural systems, vulnerability analysis, sustainable intensification, and the effects of extreme weather events on crop yields.",https://en.wikipedia.org/wiki/Climate_change_and_agriculture
10471,Climate Change Policy and Economics,2002,Economics and Econometrics,20,"Economics, Econometrics and Finance",2,Social Sciences,Climate Change; Economic Impacts; Greenhouse Gas Emissions; Policy Instruments; Carbon Pricing; Socioeconomic Pathways; Energy Transition; Global Warming; Mitigation Strategies; Environmental Policy,"This cluster of papers focuses on the economic implications of climate change policies, including the impacts of greenhouse gas emissions, energy transition, and mitigation strategies. It explores various policy instruments such as carbon pricing and examines the socioeconomic pathways related to climate change. The research also delves into the potential global warming effects and the assessment of different environmental policies.",https://en.wikipedia.org/wiki/Economics_of_climate_change
10485,"Bullying, Victimization, and Aggression",3207,Social Psychology,32,Psychology,2,Social Sciences,Bullying; Cyberbullying; Aggression; Peer Victimization; School Climate; Violent Video Games; Psychological Adjustment; Adolescent Development; Social Skills Training; Mental Health,"This cluster of papers explores the various forms of bullying, including traditional and cyberbullying, their impact on psychological well-being, and the role of school climate and social skills training in addressing these issues. It delves into topics such as aggression, peer victimization, violent video games, and their effects on adolescent development and mental health.",https://en.wikipedia.org/wiki/Bullying
10487,Plant and animal studies,1105,"Ecology, Evolution, Behavior and Systematics",11,Agricultural and Biological Sciences,1,Life Sciences,Pollinator Decline; Ecosystem Services; Plant-Animal Interactions; Biodiversity; Crop Pollination; Habitat Fragmentation; Mutualistic Networks; Global Change; Invasive Species; Climate Change,"This cluster of papers explores the impact of pollinator decline on ecosystems and agriculture, focusing on plant-animal interactions, biodiversity, crop pollination, habitat fragmentation, and the effects of global change and invasive species. The papers discuss the importance of pollinators for ecosystem services and highlight the challenges posed by climate change and habitat loss to pollinator populations.",https://en.wikipedia.org/wiki/Pollinator_decline
10508,Patient Safety and Medication Errors,3604,Emergency Medical Services,36,Health Professions,4,Health Sciences,Medical Errors; Patient Safety Culture; Surgical Safety Checklist; Adverse Events; Teamwork Training; Healthcare Quality; Safety Climate; Medication Errors; Communication Breakdowns; Incidence of Adverse Events,"This cluster of papers focuses on improving patient safety in healthcare settings, with a particular emphasis on addressing medical errors, implementing surgical safety checklists, promoting teamwork training, and cultivating a culture of safety. The research also delves into understanding adverse events, medication errors, communication breakdowns, and the incidence of adverse events to enhance healthcare quality.",https://en.wikipedia.org/wiki/Patient_safety
10520,Mycotoxins in Agriculture and Food,1110,Plant Science,11,Agricultural and Biological Sciences,1,Life Sciences,Mycotoxins; Toxicology; Fungal Pathogens; Food Safety; Aflatoxin; Health Effects; Regulations; Detoxification; Climate Change; Risk Assessment,"This cluster of papers focuses on the research and impact of mycotoxins, particularly aflatoxin, on human and animal health, food safety, regulations, detoxification methods, and the influence of climate change. It also addresses the toxicology of various mycotoxins, fungal pathogens, and the assessment of health risks associated with mycotoxin exposure.",https://en.wikipedia.org/wiki/Mycotoxin
10555,Fire effects on ecosystems,2306,Global and Planetary Change,23,Environmental Science,3,Physical Sciences,Climate Change; Forest Fires; Wildfire Activity; Global Emissions; Fire Regimes; Boreal Forests; Soil Properties; Ecosystem Resilience; Carbon Loss; Remote Sensing,"This cluster of papers explores the impact of climate change on forest wildfires, including the increase in wildfire activity, global fire emissions, fire regimes, and the resilience of ecosystems. It also delves into the effects of wildfires on soil properties, carbon loss, and the use of remote sensing for monitoring and assessment.",https://en.wikipedia.org/wiki/Effects_of_climate_change_on_wildfires
10643,Marine and coastal plant biology,1910,Oceanography,19,Earth and Planetary Sciences,3,Physical Sciences,Seagrasses; Kelp Forests; Marine Biodiversity; Ocean Acidification; Ecosystem Resilience; Coastal Protection; Macroalgae; Climate Change Impacts; Benthic Communities; Global Seaweed Distribution,"This cluster of papers focuses on the ecological dynamics of marine environments, with a particular emphasis on seagrasses, kelp forests, and macroalgae. It explores the impacts of climate change, ocean acidification, and human activities on marine biodiversity and ecosystem resilience. Additionally, it addresses the role of marine vegetation in coastal protection and the global distribution patterns of seaweed.",https://en.wikipedia.org/wiki/Marine_ecosystem
10644,Cryospheric studies and observations,1902,Atmospheric Science,19,Earth and Planetary Sciences,3,Physical Sciences,Glacier; Climate Change; Water Availability; Ice Sheet; Sea Level Rise; Himalayas; Antarctica; Snow Cover; Hydrology; Remote Sensing,"This cluster of papers focuses on the impacts of climate change on glaciers, ice sheets, and water availability in regions such as the Himalayas and Antarctica. It explores topics such as glacier mass balance, sea level rise, snow cover monitoring, and hydrological responses to glacier melt.",https://en.wikipedia.org/wiki/Retreat_of_glaciers_since_1850
10647,Coastal and Marine Dynamics,1904,Earth-Surface Processes,19,Earth and Planetary Sciences,3,Physical Sciences,Coastal Dynamics; Sea-Level Rise; Shoreline Change; Wave Modeling; Coastal Vulnerability; Beach Erosion; Sediment Transport; Climate Change Impacts; Coastal Management; Remote Sensing,"This cluster of papers encompasses a wide range of topics related to coastal dynamics, including sea-level rise, shoreline change, wave modeling, coastal vulnerability, beach erosion, sediment transport, climate change impacts, coastal management, and remote sensing techniques. The papers collectively aim to understand and address the complex interactions between natural processes and human activities in coastal environments.",https://en.wikipedia.org/wiki/Coastal_dynamics
10659,Marine animal studies overview,2303,Ecology,23,Environmental Science,3,Physical Sciences,Marine Mammals; Anthropogenic Noise; Habitat Change; Cetaceans; Predator-Prey Interactions; Climate Change; Acoustic Communication; Ecosystem Sentinels; Conservation; Population Dynamics,"This cluster of papers explores the ecology, behavior, and conservation of marine mammals, with a focus on the impacts of anthropogenic noise, habitat change, and climate change on cetaceans. It also delves into predator-prey interactions, acoustic communication, and the role of marine mammals as indicators of ecosystem health. The research emphasizes the need for conservation efforts to mitigate human-induced threats to these animals.",https://en.wikipedia.org/wiki/Marine_mammal_ecology
10747,Disaster Management and Resilience,3312,Sociology and Political Science,33,Social Sciences,2,Social Sciences,Resilience; Disaster; Community; Risk; Vulnerability; Emergency Management; Social Capital; Climate Change Adaptation; Hazard Mitigation; Crisis Response,"This cluster of papers focuses on community resilience to natural disasters, encompassing topics such as risk perception, social vulnerability, emergency management, climate change adaptation, and the role of social capital in disaster preparedness and response.",https://en.wikipedia.org/wiki/Disaster_resilience
