topic_id,topic_name,subfield_id,subfield_name,field_id,field_name,domain_id,domain_name,keywords,summary,wikipedia_url
13591,Pasture and Agricultural Systems,1107,Forestry,11,Agricultural and Biological Sciences,1,Life Sciences,Perennial Pastures; Grazing Management; Water Use Efficiency; Drought Survival; Soil Water Balance; Temperate Grasses; Sustainable Grazing Systems; Summer Dormancy; Crop-Livestock Farming; Climate Change Impacts,"This cluster of papers focuses on the management of perennial pasture systems in Australia, with an emphasis on topics such as grazing management, water use efficiency, drought survival strategies, soil water balance, and the impact of climate change. The research explores the characteristics and performance of temperate grasses, sustainable grazing systems, and the potential contribution of perennial legumes to agricultural sustainability in dryland cropping systems.",https://en.wikipedia.org/wiki/Perennial_grass
13603,Corporate Social Responsibility and Sustainability,1407,Organizational Behavior and Human Resource Management,14,"Business, Management and Accounting",2,Social Sciences,Corporate Social Responsibility; Sustainability; Business Ethics; Social Innovation; Resilient Cities; Climate Change; Stakeholder Engagement; Digital Responsibility; Environmental Policy; Urban Planning,"This cluster of papers explores the intersection of corporate social responsibility, sustainability, and business ethics. It delves into topics such as stakeholder engagement, social innovation, resilient cities, climate change, digital responsibility, and urban planning. The papers discuss the role of businesses in addressing environmental challenges and driving positive societal impact.",https://en.wikipedia.org/wiki/Corporate_social_responsibility
13628,Agricultural Productivity and Crop Improvement,1102,Agronomy and Crop Science,11,Agricultural and Biological Sciences,1,Life Sciences,Forage Production; Climate Change; Crop Adaptation; Genetic Improvement; Drought Tolerance; Soil Fertility; Plant Breeding; Sustainable Agriculture; Genetic Resources; Agroecosystem,"This cluster of papers focuses on the adaptation of forage production to the challenges and opportunities arising from climate change. It covers topics such as forage crop breeding, genetic improvement, drought tolerance, soil fertility, and sustainable agriculture in the context of changing environmental conditions.",https://en.wikipedia.org/wiki/Climate_change_adaptation
13663,"Sustainability, Environment, and Optimization Algorithms",2312,Water Science and Technology,23,Environmental Science,3,Physical Sciences,Water Resources Management; Sustainability; Climate Change; Genetic Algorithm; Multi-Agent System; Healthcare Technology; Land Use Change; Biodiversity Conservation; Natural Resource Accounting; Environmental Policy,"This cluster of papers focuses on integrated water resources management, sustainability, and the impact of climate change on water availability. It explores the use of genetic algorithms and multi-agent systems in optimizing resource management, as well as the intersection of healthcare technology and environmental sustainability. The cluster also delves into land use change, biodiversity conservation, and the accounting of natural resources, providing valuable insights for environmental policy.",https://en.wikipedia.org/wiki/Water_resource_management
13668,Agricultural and Rural Development Research,1107,Forestry,11,Agricultural and Biological Sciences,1,Life Sciences,Rangelands; Livestock; Sustainability; Agriculture; Climate Change; Grazing; Vegetation; Economic Analysis; Migration; Cooperatives,"This cluster of papers focuses on the sustainable management of rangelands, livestock, and agriculture, addressing topics such as climate change effects, economic analysis, migration patterns, and the role of cooperatives in the context of rangeland management. It also explores the impact of grazing, vegetation characteristics, and the sustainability of livestock production.",https://en.wikipedia.org/wiki/Rangeland_management
13678,Agricultural Research and Practices,1100,General Agricultural and Biological Sciences,11,Agricultural and Biological Sciences,1,Life Sciences,Agricultural Sustainability; Developing Countries; Climate Change Adaptation; Food Security; Rural Development; Smallholder Farming; Sustainable Management; Community Empowerment; Natural Disaster Management; Trade and Economic Growth,"This cluster of papers focuses on the sustainability of agricultural practices in developing countries, particularly in the context of climate change adaptation, food security, rural development, and smallholder farming. It also addresses the management of natural disasters, trade's impact on economic growth, and strategies for sustainable agricultural management.",https://en.wikipedia.org/wiki/Agricultural_sustainability
13743,Italian Literature and Culture,1200,General Arts and Humanities,12,Arts and Humanities,2,Social Sciences,Cultural Studies; Innovation; Architectural Competitions; Climate Change; Media and Communication; Identity; Urban Planning; Literature; Ethnobotany; Emotional Intelligence,"This cluster of papers covers a wide range of topics including cultural studies, innovation in humanities and social sciences, architectural competitions, climate change, media and communication, identity, urban planning, literature, ethnobotany, and emotional intelligence.",https://en.wikipedia.org/wiki/Cultural_studies
13756,International Environmental Law and Policies,2308,"Management, Monitoring, Policy and Law",23,Environmental Science,3,Physical Sciences,International Environmental Law; Nuclear Power; Climate Change; Liability Regimes; Bibliometric Analysis; Sustainable Energy; Global Governance; Environmental Justice; Regulatory Challenges; Indigenous Peoples' Rights,"This cluster of papers focuses on the principles, governance, and challenges of international environmental law, including topics such as nuclear power, climate change, liability regimes, sustainable energy, global governance, environmental justice, regulatory challenges, and indigenous peoples' rights.",https://en.wikipedia.org/wiki/International_environmental_law
13760,"Finance, Taxation, and Governance",2308,"Management, Monitoring, Policy and Law",23,Environmental Science,3,Physical Sciences,Ecotourism; Sustainable Development; Environmental Education; Forest Genetic Diversity; Community Participation; Public Policies; Rural Tourism; Climate Change; Social Sustainability; Natural Resource Management,"This cluster of papers explores the intersection of ecotourism, sustainable development, and environmental conservation in Latin America. It covers topics such as the impact of ecotourism on indigenous communities, forest genetic diversity, climate change adaptation, community-based tourism, and the role of public policies in promoting sustainable tourism practices. The papers also delve into environmental education, social sustainability, and the management of natural resources within the context of ecotourism.",https://en.wikipedia.org/wiki/Ecotourism
13811,Earth Systems and Cosmic Evolution,1902,Atmospheric Science,19,Earth and Planetary Sciences,3,Physical Sciences,Gaia Hypothesis; Earth Systems Science; Complex Adaptive Systems; Environmental Regulation; Planetary Self-Regulation; Daisyworld; Microbial Ecology; Global Warming; Biosphere; Climate Change,"This cluster of papers explores the Gaia hypothesis, which proposes that the Earth is a self-regulating system involving complex interactions between the biosphere, atmosphere, hydrosphere, and lithosphere. It delves into topics such as planetary self-regulation, environmental regulation, microbial ecology, daisyworld modeling, and the impact of human activities on global warming and climate change.",https://en.wikipedia.org/wiki/Gaia_hypothesis
13825,Economic Policies and Impacts,2002,Economics and Econometrics,20,"Economics, Econometrics and Finance",2,Social Sciences,Tax Competition; Fiscal Decentralization; Monetary Policy Transmission; Labor Market Flexibility; International Trade; Climate Change Policy; Pension Reforms; Regulatory Risk; Immigration Policies; Public Goods Provision,"This cluster of papers covers a wide range of topics in economic policy and public finance research, including tax competition among states, fiscal decentralization, monetary policy transmission, labor market flexibility, international trade, climate change policy, pension reforms, regulatory risk, immigration policies, and public goods provision.",https://en.wikipedia.org/wiki/Public_finance
13838,Plant and soil sciences,1100,General Agricultural and Biological Sciences,11,Agricultural and Biological Sciences,1,Life Sciences,Agroecology; Sustainable Agriculture; Organic Farming; Soil Management; Biodiversity; Crop Production; Environmental Impact; Climate Change Adaptation; Rural Communities; Food Security,"This cluster of papers covers a wide range of topics related to agroecology, sustainable agriculture, and organic farming. It includes research on soil management, biodiversity, crop production, environmental impact, and climate change adaptation in rural communities. The papers also discuss the importance of food security and the challenges of agricultural practices in diverse ecological contexts.",https://en.wikipedia.org/wiki/Agroecology
13856,Advanced Power Generation Technologies,2208,Electrical and Electronic Engineering,22,Engineering,3,Physical Sciences,Thermal Conductivity; Steam Generation; Hydrogen-Oxygen Generators; Nuclear Power Plants; Energy Efficiency; Climate Change; Electric Power Industry; Gas Turbines; Renewable Energy; Combustion Technology,"This cluster of papers covers a wide range of topics related to power generation, energy systems, and the impact of various technologies on climate change. It includes research on thermal conductivity, steam generation, hydrogen-oxygen generators, nuclear power plants, energy efficiency, and the integration of renewable energy. The papers also discuss the challenges and prospects for the electric power industry, the use of gas turbines, and advancements in combustion technology.",https://en.wikipedia.org/wiki/Power_generation
13870,Environmental and Ecological Studies,2105,"Renewable Energy, Sustainability and the Environment",21,Energy,3,Physical Sciences,Renewable Energy; Climate Change; Environmental Impact Assessment; Sustainable Development; Ecosystem Approach; Energy Policy Analysis; Geographic Information Systems; Urban Planning; Biomass Energy; SMEs in Developing Economies,"This cluster of papers covers a wide range of topics related to energy, climate change, and environmental impact assessment. It includes discussions on renewable energy sources, energy policy analysis, the use of geographic information systems in urban planning, and the assessment of biomass energy. The cluster also addresses the impact of climate change on various regions and the role of small and medium enterprises (SMEs) in developing economies.",https://en.wikipedia.org/wiki/Energy_and_climate_change
13893,Sustainable Development and Policies,2308,"Management, Monitoring, Policy and Law",23,Environmental Science,3,Physical Sciences,Green Jobs; Sustainable Development; Low-Carbon Economy; Renewable Energy; Climate Change; Environmental Sustainability; Social Innovation; Economic Growth; Workforce Transition; Policy Challenges,"This cluster of papers focuses on the intersection of green jobs, sustainable development, and low-carbon economy. It explores topics such as renewable energy, climate change, environmental sustainability, workforce transition, and policy challenges in the context of creating a more sustainable and environmentally friendly economy.",https://en.wikipedia.org/wiki/Green_job
13933,Whitehead's Philosophy and Applications,2308,"Management, Monitoring, Policy and Law",23,Environmental Science,3,Physical Sciences,Green Economics; Sustainability; Environmental Social Science; Climate Change; Civil Commons; Globalization; Anti-Capitalism; Ecofeminism; Corporate Governance; Social Justice,"This cluster of papers revolves around the interdisciplinary field of Green Economics, focusing on sustainability, environmental social science, climate change, civil commons, globalization, anti-capitalism, ecofeminism, corporate governance, and social justice.",https://en.wikipedia.org/wiki/Green_economics
13939,Archaeology and Natural History,3314,Anthropology,33,Social Sciences,2,Social Sciences,Traditional Irrigation; Water Sustainability; Community Resilience; Hydrologic Interactions; Cultural Heritage; Ecosystem Services; Climate Adaptation; Archaeological Investigations; Social-Ecological Systems; Biodiversity Management,"This cluster of papers explores the resilience of traditional irrigation communities in the Southwest USA, focusing on water sustainability, hydrologic interactions, cultural heritage, and ecosystem services. It delves into the social-ecological systems supporting community resilience, climate adaptation, and the management of biodiversity. The research also includes archaeological investigations and emphasizes the importance of traditional irrigation in maintaining community livelihoods and culture.",https://en.wikipedia.org/wiki/Irrigation_in_the_United_States
13956,Sociopolitical Dynamics in Nepal,3317,Demography,33,Social Sciences,2,Social Sciences,Youth Employment; Globalization; Identity Politics; Conflict; Education; Poverty; Social Inequality; Maoist Insurgency; Climate Change; Democratization,"This cluster of papers explores the multifaceted issues surrounding youth employment in a global context, including the impact of globalization, identity politics, conflict, education challenges, poverty alleviation, social inequality, Maoist insurgency, climate change adaptation, and democratization efforts. The papers cover a wide range of geographical regions, with a particular focus on Nepal and other developing countries.",https://en.wikipedia.org/wiki/Youth_employment
13997,Scientific Research and Studies,2306,Global and Planetary Change,23,Environmental Science,3,Physical Sciences,Climate Change; Adaptation; Sustainable Development; Global Warming; Land Use Planning; Greenhouse Gas Emissions; Remote Sensing; Geographic Information Systems (GIS); Ecological Consequences; Urban Adaptation,"This cluster of papers covers a wide range of topics related to the impacts of climate change, including adaptation strategies, sustainable development, greenhouse gas emissions, land use planning, and ecological consequences. It also explores the challenges and opportunities for urban adaptation to climate change, as well as the role of remote sensing and GIS in regional geomorphological mapping for land use planning.",https://en.wikipedia.org/wiki/Climate_change
14009,Ecology and Conservation Studies,1110,Plant Science,11,Agricultural and Biological Sciences,1,Life Sciences,Vascular Plants; Flora; Conservation; Korean Peninsula; Endemic Species; Climate Change; Invasive Species; Habitat Environment; Ecological Characteristics; Genetic Resources,"This cluster of papers focuses on the biodiversity, conservation, and ecological characteristics of vascular plants in Korea, including endemic species, invasive species management, and the impact of climate change on plant habitats. It also covers the assessment of habitat environments and the preservation of genetic resources.",https://en.wikipedia.org/wiki/Flora_of_Korea
14010,Food Industry and Aquatic Biology,1106,Food Science,11,Agricultural and Biological Sciences,1,Life Sciences,Food Security; Nutrition; Climate Change; Functional Foods; Agricultural Development; Fisheries Management; Micronutrients; Biological Resources; Sustainable Development; Economic Implications,"This cluster of papers covers a wide range of topics related to food security, nutrition, and sustainable development. It includes research on the impact of climate change on food production, the development of functional foods, fisheries management, micronutrient deficiencies, and economic implications of agricultural policies. The papers also address issues such as the use of by-products in food production, assessment of bioavailability of minerals, and the role of innovative technologies in improving food quality and safety.",https://en.wikipedia.org/wiki/Food_security
14018,Agriculture and Biological Studies,1100,General Agricultural and Biological Sciences,11,Agricultural and Biological Sciences,1,Life Sciences,Agriculture; Plant Genetics; Crop Productivity; Soil Fertility; Livestock Breeding; Food Security; Biotechnology; Sustainable Farming; Climate Change Adaptation; Agroecosystem Management,"This cluster of papers covers a wide range of topics in agricultural science and technology, including plant genetics, crop productivity, soil fertility, livestock breeding, food security, biotechnology, sustainable farming practices, climate change adaptation, and agroecosystem management.",https://en.wikipedia.org/wiki/Agricultural_science
14027,21st Century Education and Governance,3303,Development,33,Social Sciences,2,Social Sciences,Sustainable Development Goals; Environmental Policy; Climate Change; 21st Century Skills; Knowledge Management; Global Inequality; Regional Development; Educational Technology; Resource Management; Social Equity,"This cluster of papers covers a wide range of topics related to sustainable development, global governance, and the challenges facing the world in the 21st century. It includes discussions on environmental policy, climate change, 21st-century skills, knowledge management, global inequality, regional development, educational technology, resource management, and social equity.",https://en.wikipedia.org/wiki/Sustainable_development
14050,Forest Ecology and Conservation,1107,Forestry,11,Agricultural and Biological Sciences,1,Life Sciences,Agroforestry; Biodiversity Conservation; Medicinal Plants; Forest Health; Land Suitability; Community Management; Geographic Information System; Social Capital; Climate Resilience; Soil Conservation,"This cluster of papers focuses on various aspects of agroforestry, biodiversity conservation, and sustainable land management practices. It covers topics such as medicinal plant diversity, forest health assessment, land suitability evaluation, community-based forest management, and the use of geographic information systems for mapping and monitoring. The cluster also explores the role of social capital in supporting agroforestry initiatives and emphasizes the importance of climate resilience and soil conservation in these practices.",https://en.wikipedia.org/wiki/Agroforestry
14053,Dengue and Mosquito Control Research,3312,Sociology and Political Science,33,Social Sciences,2,Social Sciences,Public Perception; Sustainable Development; Water Pollution; Agriculture Development; Food Safety; Climate Change; Ecosystem Vulnerability; Insecticide Susceptibility; Community Participation; Vector Control,"This cluster of papers covers a wide range of topics related to sustainable development, including public perception of development issues, impact of water pollution, interpretive structural analysis of agriculture development, antioxidant activity determination, food safety, climate change vulnerability, ecological benefits, insecticide susceptibility, and community participation in vector control. The papers emphasize the importance of public awareness and community involvement in addressing various environmental and public health challenges for sustainable development.",https://en.wikipedia.org/wiki/Sustainable_development
14069,Scientific Research Methodologies and Applications,2312,Water Science and Technology,23,Environmental Science,3,Physical Sciences,Water Treatment; Environmental Monitoring; Sustainability; Decision Trees; Neural Networks; Sensors; Climate Change; Agricultural Production; Remote Sensing; Data Analysis,"This cluster of papers focuses on water resources management, environmental monitoring, and sustainability. It covers topics such as water treatment, climate change impact on water resources and agricultural production, use of decision trees and neural networks for data analysis, sensors for remote sensing, and the application of modern technologies in environmental monitoring.",https://en.wikipedia.org/wiki/Water_management
14073,Diverse Global Research Studies,3312,Sociology and Political Science,33,Social Sciences,2,Social Sciences,Water Crisis; Social Inequality; Global Development; Environmental Policy; Health Impact; Economic Reforms; Human Rights Law; Climate Change; International Cooperation; Socioeconomic Disparities,"This cluster of papers focuses on the global water crisis, social inequality, and their intersection with various aspects of development, including economic reforms, human rights law, climate change, and international cooperation. It also explores the health and environmental impacts of the water crisis and the implications for socioeconomic disparities.",https://en.wikipedia.org/wiki/Water_crisis
14087,"Economic, Educational, Environmental and Organizational Development",3300,General Social Sciences,33,Social Sciences,2,Social Sciences,Research Methods; Health Sciences; Urban Landscapes; Sustainability Economics; Nutrition and Lifestyle; Climate Change; Educational Technology; Financial Reporting; Cultural Studies; Globalization Effects,"This cluster of papers covers a wide range of interdisciplinary research topics, including health sciences, urban landscapes, sustainability economics, nutrition and lifestyle, climate change, educational technology, financial reporting, cultural studies, and the effects of globalization. The papers reflect a diverse set of academic disciplines and research methodologies.",https://en.wikipedia.org/wiki/Interdisciplinary_research
14116,Aviation History and Innovations,1207,History and Philosophy of Science,12,Arts and Humanities,2,Social Sciences,Perception; Coastal Management; Aircraft Navigation; Health Models; Data Visualization; Transboundary Governance; Environmental Cooperation; Digital Competence; Storytelling; Social Climate,"This cluster of papers covers a wide range of interdisciplinary topics, including perception in psychology, coastal habitat management, aircraft navigation, health models, data visualization, transboundary governance, environmental cooperation, digital competence, storytelling, and social climate. The papers reflect a convergence of scientific and humanistic inquiry.",https://en.wikipedia.org/wiki/Interdisciplinarity
14152,Healthcare Facilities Design and Sustainability,3322,Urban Studies,33,Social Sciences,2,Social Sciences,Sustainable Development; Urban Planning; Public Health; Environmental Quality; Healthcare Facilities; Social Inequality; Community Engagement; Climate Change; Peace Engineering; Ethical Governance,"This cluster of papers focuses on the intersection of sustainable development, urban planning, public health, and environmental quality. It addresses challenges such as social inequality, climate change, and healthcare facility design, while emphasizing community engagement and peace engineering. The papers also explore ethical governance and the promotion of well-being in urban environments.",https://en.wikipedia.org/wiki/Sustainable_urban_development
14157,Environmental and Agricultural Sciences,2312,Water Science and Technology,23,Environmental Science,3,Physical Sciences,Hydrological Effects; Water Resources; China; Climate Change; Soil Moisture; River Basins; Erosion Control; Remote Sensing; Sustainability; Environmental Impact,"This cluster of papers focuses on the hydrological effects, water resource management, and environmental impact in China, particularly in relation to river basins, soil moisture, erosion control, and the influence of climate change. It also explores the use of remote sensing for monitoring and sustainability efforts.",https://en.wikipedia.org/wiki/Water_resources_management_in_China
14169,Public Health and Environmental Issues,2307,"Health, Toxicology and Mutagenesis",23,Environmental Science,3,Physical Sciences,Public Health; Environmental Management; Water Quality; Healthcare Access; Climate Change; Community-based Resource Management; Chronic Disease Control; Epidemiological Analysis; Sustainable Development; Healthcare Policy,"This cluster of papers covers a wide range of topics related to public health, environmental management, and sustainable development. It includes research on healthcare access, chronic disease control, water quality, climate change impact on health, community-based resource management, and epidemiological analysis. The papers also address issues such as healthcare policy, environmental impact assessment, and the intersection of social and environmental factors with public health.",https://en.wikipedia.org/wiki/Public_health
14177,Water Resources and Management,2303,Ecology,23,Environmental Science,3,Physical Sciences,Lake Baikal; ecological change; water quality; climate change; Selenga River Basin; biodiversity; sediment transport; nutrient emissions; land-use change; freshwater ecosystem,"This cluster of papers focuses on the environmental impact, ecological changes, and water quality issues in the Lake Baikal ecosystem, particularly in relation to climate change, sediment transport, nutrient emissions, and land-use changes in the Selenga River Basin. The research also addresses the biodiversity and unique freshwater ecosystem of Lake Baikal.",https://en.wikipedia.org/wiki/Lake_Baikal
